volume,issue,month,year,type,title,author,abstract_research_summary,abstract managerial summary
44,5,May,2023,RESEARCH SUMMARY,Corporate social counterpositioning: How attributes of social issues influence competitive response,"Aharon Mohliver, Donal Crilly, Aseem Kaul","Whilst existing research generally assumes corporate social responsibility (CSR) is seen as universally positive, firms increasingly adopt practices, and take stands, on highly polarizing social issues (e.g., gun-control, LGBTQ rights, abortion). To better understand this phenomenon, we develop a theory about when firms will emulate, ignore, or oppose each other's CSR efforts, based on attributes of the underlying social issue (its salience and polarization), the level of market competition, and the substantiveness of CSR. Our theory predicts several distinct equilibrium outcomes, including the potential for social counter-positioning, whereby rival firms take advantage of socio-political polarization to horizontally differentiate by taking opposing stances on a polarizing issue. Counterpositioning is more likely when salience is high, but agreement is low, when markets are competitive, and when CSR is largely symbolic.","Firms increasingly find themselves drawn, willingly or not, to taking stances on a controversial social issue (e.g., gun rights, abortion), though doing so risks alienating (some) stakeholders. In this paper, we develop a theory of why, when, and how firms should take a stance on a polarizing issue. We argue that firms profit from doing so when (1) the issue is salient, (2) markets are competitive, and (3) the actions are mostly symbolic. We also show that taking a stance on polarizing issues creates opportunities for the firms' competitors to counter their ideological positioning, strengthening weaker rivals in the process. Thus, in competitive markets, taking clear stances on polarizing, salient issues can segment the market, increasing the profits of all firms, and, potentially, intensifying polarization."
44,5,May,2023,RESEARCH SUMMARY,Cascading innovation: R&D team design and performance implications of mobility,Melody H. Chang,"Given the high cost of external hiring and uncertainty related to performance benefits, how can organizations foster an environment that maximizes the post-mobility performance of external hires and their collaborators? In this article, I posit that R&D team design is an important factor that could shape the post-mobility performances of both groups. Building on the interfirm mobility, innovation, and teams literatures, I argue that technological knowledge diversity within teams and across teams could differently impact innovation performance. Analyzing 63,976 interfirm moves of engineers and scientists, I find that the post-mobility performances of external hires and teammates are conditioned by team design. A high level of within-team diversity improves the performances of both groups, while a high level of across-team diversity hurts their innovation outcomes.","In the war for talent, firms often offer premium wages to source external hires. Yet there have been unclear expectations about the post-mobility outcomes of these hires and the implications for team performance. To better assess the value of hiring, managers should look beyond the performance of external hires and also consider team member performance. In the context of knowledge production activities, external hires, on average, experience an improvement in innovation performance after they move. Working with an external hire reduces the productivity of immediate collaborators but leads to more breakthrough innovations with greater technological impact. Most importantly, the performances of external hires and their teammates can be further improved by effectively designing R&D teams. Recomposing teams such that a high level of diversity exists within a team but minimal divergence across teams creates an environment that appears to enhance post-mobility innovation activities."
44,5,May,2023,RESEARCH SUMMARY,A rivalry-based theory of gender diversity,"John Kenneth Mawdsley, Lionel Paolella, Rodolphe Durand","We offer a rivalry-based perspective of gender diversity as a form of competitive action. We theorize that a firm adjusts its senior-level female representation when they identify business opportunities that may be seized by demonstrating alignment to gender parity expectations. Examining U.S. corporate law firms and potential buyers of their services, we theorize and find that when the buyers of rivals of the focal firm increase their gender diversity, the focal firm responds by increasing its female partner representation. Reinforcing the strategic approach to managing gender diversity, we also show that a focal firm reduces its gender-related response to rivals' buyers as the opportunity to attract those buyers decreases, and when the focal firm can use racial diversity as a credible substitute for gender diversity.",Do firms increase senior level gender diversity for normative or competitive reasons? We examine this question and test whether firms adjust their gender diversity to align with the gender diversity values of their competitors' clients. Our study shows that U.S. corporate law firms increase their level of female partners when the clients of their stronger competitors increase gender diversity in their executive rank. We also show that firms' gender diversity response weakens when there is a lower probability of luring those clients and when firms can offer racial diversity as a credible alternative signal of pro-diversity values. Our competitive-based view of gender diversity encourages managers to consider how and when proactive gender diversity improvement can be a mechanism for improving their firms' market position.
44,5,May,2023,RESEARCH SUMMARY,"Hitting reset: Industry evolution, generational technology cycles, and the dynamic value of firm experience","Hakan Ozalp, J.P. Eggers, Franco Malerba","We study how the value of depth and breadth of experience shifts across generational technology cycles and industry evolution. Experience breadth builds organizational flexibility that is valuable during technology transitions and when the industry is younger, while experience depth builds domain-specific resources that are important during periods of technology stability and later periods of industry evolution. We test our theory in the console game industry, where publishers face repeated periods of transition and stability across multiple console generations. We find support for most hypotheses, except that the value of breadth correlates with the magnitude of any transition instead of decreasing linearly over time. We contribute to research on the changing value of firm experience and to the understanding of generational technological change during industry evolution.","Many industries face generational changes. How incumbent firms handle those transitions is important to firm survival and success. We study how the prior experience of video game publishers helps them navigate transitions. First, we find that firms with deep experience in a genre produce more successful games in that genre only during stable periods in the industry. Second, the benefits of deep experience increase over time as some of the experience-built capabilities of the firm survive technological transitions. Third, broad and diversified firms perform best during generational transitions as they successfully enter new domains made popular by the generational shift. We suggest that the product strategies of video game firms should depend on the relevant experience they possess and the degree of environmental change."
44,5,May,2023,RESEARCH SUMMARY,Do employees' views matter in corporate governance? The relationship between employee approval and CEO dismissal,"Danni Wang, Qi Zhu, Bruce J. Avolio, Wei Shen, David Waldman","As important stakeholders of a firm, employees are critical to firm success because they are directly engaged in strategy implementation. Accordingly, we theorize that employees' views can impact assessment of the CEO by the board of directors beyond firm financial performance and security analysts' recommendations. Specifically, we hypothesize that employee approval of a CEO's leadership is predictive of the board's CEO dismissal decision, particularly when there is relatively higher firm financial performance, more positive security analyst recommendations, and lower CEO power. Using longitudinal data from 338 firms and 1,252 firm-year observations between 2010 and 2018, we found empirical support for the above predictions. Our theory and supportive findings have important implications for research and practice regarding employee engagement, strategic leadership, and corporate governance.","Because employees are important stakeholders of a firm and critical to its success, we argue that their views about the CEO can impact how the board of directors evaluates the CEO beyond firm financial performance and security analysts' recommendations. Our results show that higher employee approval of CEO leadership (measured by data collected from Glassdoor.com over multiple years) negatively predicts CEO dismissal, particularly when the firm performs better financially, gets more positive recommendations from security analysts, and the CEO has less power relative to the board. These findings suggest that employees' views do matter in the retention or dismissal of the CEO, and that CEOs should be mindful of how their employees view their leadership and the strategies they are promoting at their firms."
