volume,issue,month,year,type,title,author,abstract_research_summary,abstract managerial summary
44,3,March,2023,RESEARCH SUMMARY,Precarious situations: A prelude to hiring more hubristic chief executive officers,"Aaron D. Hill, Tessa Recendes, Yuting Yang","We build upon evidence suggesting the precariousness of the situation organizations face when trying to fill chief executive officer (CEO) openings affects both which executives seek and accept such positions and which executives are sought and endorsed by those tasked with hiring. We argue that while more precarious situations likely deter some executives from pursuing and/or accepting such opportunities, more hubristic executives' tendencies make them likely to do so despite the associated challenges. Concordantly, those tasked with filling CEO openings likely view more hubristic executives as particularly important for combatting the challenges of more precarious situations, leading them to seek and endorse such executives. Using multiple conceptualizations of precarious situations, we find support for our arguments in a sample of CEO changes in S&P 500 firms.","Why do organizations select more hubristic executives to fill CEO openings? We answer this question by highlighting the role that situational precariousness plays. Specifically, not all CEO openings are equally attractive to prospective CEOs and not all prospective CEOs are equally attractive to decision makers tasked with filling such openings. We argue and find support for the notion that more hubristic executives' tendencies make them more likely to pursue and accept CEO opportunities at organizations in more precarious situations while those tasked with filling CEO openings likewise believe more hubristic executives' tendencies are particularly important given the precarious situations those organizations face. Our findings advance knowledge of CEO hubris and provide insights for practice."
44,3,March,2023,RESEARCH SUMMARY,The future of the web? The coordination and early-stage growth of decentralized platforms,"Ying-Ying Hsieh, Jean-Philippe Vergne","This abductive study investigates how management occurs without managerial authority as part of a previously unseen organizational form—the decentralized platform with an independent market value. Our mixed-methods study of the cryptocurrency industry draws on fuzzy-set qualitative comparative analyses (QCA) to analyze archival and interview data and offer new theory on how decentralized platforms coordinate activities to grow in an early-stage, before network effects kick in. We find that, in the absence of a central authority, platforms coordinate activities with three mechanisms, namely decentralized (a) algorithmic coordination, (b) social coordination, and (c) goal coordination. Our QCA treat these mechanisms as explanatory conditions and, using a representative sample of 20 cryptocurrency platforms, reveal which configurations of decentralized coordination mechanisms nurture, or hinder, early-stage platform growth.","Firms operate around a managerial hierarchy that distributes tasks, resources, information, and rewards to organizational members who pursue common goals as contract-bound employees. From 2009, a new organizational form, called the “decentralized platform,” emerged and diffused without relying on hierarchy nor managerial authority—and without having to employ anyone. The most prominent decentralized platform, Bitcoin, has millions of users, thousands of contributors, and a market valuation never achieved before by an organization without a CEO nor shareholders. This study explicates how this unprecedented level of organizational decentralization functions in practice. We foreshadow implications for the digital economy, wherein “Web3” innovations, such as non-fungible tokens and DAOs, have already shifted the orchestrating role played by platforms in capitalist societies."
44,3,March,2023,RESEARCH SUMMARY,Revisiting managerial “style”: The replicability and falsifiability of manager fixed effects for firm policies,"Victor Esteban Jarosiewicz, David Gaddis Ross","We attempt to replicate Bertrand and Schoar (2003), who used manager fixed effects to provide evidence for managerial “style” as measured by metrics such as leverage, R&D spending, and Tobin's Q. We find that the statistical and economic significance of manager fixed effects is generally lower in our results than in theirs. This discrepancy motivated us to conduct placebo tests in which we randomize managers' spells at their firms. The results with the randomized data are generally as strong as those with the real data, suggesting (a) that the apparent explanatory power of manager fixed effects may be largely a statistical artifact and (b) that managerial “style” may manifest itself in more complex ways than can be ascertained from examining financial statement metrics.","An influential body of research uses large datasets of firm financial information to study whether individual top managers have a “style” as measured by metrics such as leverage and R&D spending. We attempt to replicate a leading paper in this body of research but obtain quite different, usually weaker results. We also try repeating the analysis using artificial datasets where managers are randomly assigned to firms other than those at which they really worked. These randomized datasets produce results that are generally as strong as those with the real data. The implications are that the statistical methodology used in this body of research may be generating spurious results and that managerial “style” may be too complex to ascertain from examining financial statement metrics."
44,3,March,2023,RESEARCH SUMMARY,Academic stars and licensing experience in university technology commercialization,"David H. Hsu, Jeffrey M. Kuhn","We examine the process by which university technology transfer offices (TTOs) allocate internal resources, which provides insight into technologies offered for commercialization to the private sector. Using detailed administrative records of patenting decisions and outcomes by one prominent U.S. research-based university's TTO over a 30-year period, we analyze the performance of invention disclosures by academic stars and by inventors with prior licensing experience. We find that the lead inventor's academic prominence (but not licensing experience) predicts patent application filing, while licensing experience (but not academic prominence) predicts patent impact and commercialization success. We supplement this descriptive analysis with follow-up interviews and empirical evaluation of possible mechanisms for this seemingly outsized role of academic stars.","Increasingly prevalent hybrid organizations are expected to fulfill multiple objectives. University technology transfer offices (TTOs) are an example of a hybrid organization and are charged with disseminating academia-originated technology for the public good as well as for economic benefit. We study how one TTO allocates internal resources, using comprehensive in-house administrative data over a 30-year span. We find that while the TTO tends to put resources behind inventions by academic stars, the commercial returns from licensing inventions from such individuals are no different than inventions by non-stars. By contrast, inventors' prior licensing experience highly predicts commercial returns. These results illustrate the challenges inherent in internal resource allocation inside a complex hybrid organization."
44,4,April,2023,RESEARCH SUMMARY,Issue Information,,,
44,4,April,2023,RESEARCH SUMMARY,Trade-offs to using standardized tools: Innovation enablers or creativity constraints?,"Milan Miric, Hakan Ozalp, Erdem Dogukan Yilmaz","In platform ecosystems, the creation of new products is often based on standardized development tools. Complementors often have a choice between either using these tools or creating the functionality themselves. In this paper, we study how the use of standardized development tools is related to the type of products created. By using data on the use of middleware (e.g., game engines) in the console video game market, we show that the use of development tools is associated with products that are less novel but with higher sales on average. We exploit a policy change that affected the ability of U.S.-based developers to hire foreign workers as an instrument for the use of development tools and find further support for these patterns.","When developing new products, firms often have to decide whether they base their technology on preexisting components and standardized tools or develop that technology themselves. In general, it has not been clear how using standardized third-party tools that may be available to all firms in an industry affects the nature of the products that are created. Using data on middleware components, such as game engines, in the console video game industry, this paper shows the use of such standardized tools is associated with the creation of products that are less novel but generate higher sales on average. This is an important strategic consideration for firms, but also for platforms that make decisions regarding whether such tools should be allowed on their platform."
44,4,April,2023,RESEARCH SUMMARY,"Innovation and profitability following antitrust intervention against a dominant platform: The wild, wild west?","Sruthi Thatchenkery, Riitta Katila","This study examines whether “unblocking” competition through antitrust intervention against a dominant platform can spur complementor innovation in platform ecosystems. Using a novel dataset on enterprise infrastructure software and a difference-in-differences design, we examine the relation between the U.S. antitrust intervention against Microsoft (dominant enterprise platform) and subsequent innovation and profitability of infrastructure applications firms (complementors). The data show that innovation among complementors—particularly ones with low market share—soared when the competitive pressure on the dominant platform amplified. However, the profitability of these complementors dropped. Our results contribute to understanding links between competition and innovation in platform ecosystems, as well as the opportunities and threats related to dominant platforms in those ecosystems.","Complementors (apps, services) that are owned by their platforms often have an unfair advantage. Antitrust action challenges the power of such dual platform-complementors, reasoning that unfair advantage blocks fair competition, and, in turn, reduces firms' incentives to innovate and thus limits consumer choice. We examine whether reducing anticompetitive barriers and platform-complementors' power revitalizes the platform ecosystem. Using a landmark antitrust case, we find mixed results: while complementors do innovate more, their profits go down. In particular, the low-share complementors that bring in the most innovation are also the ones that lose the most financially, suggesting that they may have over-relied on the platform for key assets. To develop a healthy ecosystem in the long run, platform owners may want to resist the temptation to keep complementors weak and instead help support their development to stand on their own."
44,4,April,2023,RESEARCH SUMMARY,When stronger patent law reduces patenting: Empirical evidence,"Yun Hou, I.P.L. Png, Xi Xiong","Theoretically, stronger legal protection affects strategic portfolios in two ways. As each patent becomes more effective, the gain from multiple patents would be less, reducing the demand for patents (negative inframarginal effect). With the effective price of patent protection being lower, the demand for protection and patents would increase (positive marginal effect). The net effect is more likely to be negative in complex technology industries, and magnified by patent ownership fragmentation, manufacturing assets, technological competition, and size. Exploiting variation in the shift in patent law due to the Federal Circuit Appeals Court (CAFC), we find that the average increase in patent protection due to the CAFC led businesses to reduce strategic patenting by 23.3%, and the contingent effects accorded with the hypotheses.","How should businesses adjust patent portfolios to changes in the legal protection of patents? As each patent becomes more effective, the gain from multiple patents would be less, reducing the demand for patents. With the effective price of patent protection being lower, the demand for protection and patents would increase. The net effect is more likely to be negative where the stakes (costs of holdup or gain from exclusivity) are larger. Empirical evidence from strategic patenting by U.S. manufacturing businesses between 1986 and 1992 before and after changes in patent law due to the U.S. Court of Appeals for the Federal Circuit supports our propositions."
44,4,April,2023,RESEARCH SUMMARY,Divestment of relational assets following acquisitions: Evidence from the biopharmaceutical industry,"Vivek Tandon, Navid Asgari, Ram Ranganathan","We examine whether acquisitions affect the divestment of firms' alliance-based relational assets. Using data from the biopharmaceutical industry and a matched case–control research design, we find that alliances are more likely to be terminated following acquisitions compared to alliances not subject to acquisitions. This higher termination likelihood is driven by acquisitions where the acquirer's alliance management capacity is stressed, and by alliances inherited from targets. The inherited alliance effect is attenuated by the target's partner's common connections with the acquirer but amplified by the target's partner's unique connections outside the merging firms' alliance portfolios. These findings are consistent with our relational view-based theorizing on the post-acquisition challenges of retaining alliance-based assets, contributing to corporate strategy scholarship on alliances and acquisitions.","In many industries, firms' portfolios of interorganizational alliances enable them to realize novel complementarities and, thereby, enhance their performance. In such sectors, managers also frequently acquire other organizations to obtain access to critical resources. However, what managers may overlook is that acquisitions can destabilize existing alliance relationships. In this study, we show that the acquiring firm's capacity to effectively manage alliance-based assets is stressed once it inherits the target firm's alliances. In general, target firm alliances become more challenging to sustain, and, in particular, those that hold a higher potential for novelty become more unstable. Consequently, when evaluating acquisitions, managers should look beyond obvious measures of a target alliance's value and assess the post-acquisition integration challenges that may threaten its stability."
44,4,April,2023,RESEARCH SUMMARY,Stronger together: Country-of-origin agglomeration and multinational enterprise location choice in an adverse institutional environment,"Yong Li, Jing Li, Peng Zhang, Sunhwan Gwon","Research suggests that multinational enterprises (MNEs) are attracted to locations with concentrated firms from the same home country to benefit from interactions with market forces, but it remains an open question whether such agglomeration facilitates MNEs' interactions with nonmarket actors such as the host government. We submit that since country-of-origin agglomeration can enable collective actions and create collective gains, colocation with compatriot firms will help MNEs navigate an adverse institutional environment. In line with this reasoning, we hypothesize that MNEs are more attracted to locations with country-of-origin agglomeration when MNEs face an exogenous shock that increases their regulatory burden in the host country. Our analysis offers corroborative evidence. The study adds to research on agglomeration, institutional environment, and location strategy.","Why do multinational enterprises (MNEs) locate near compatriot firms in a foreign location? The commonly recognized benefits include resource access and knowledge spillover from interactions with market forces such as suppliers and customers. We submit that colocation with compatriot firms can also help MNEs navigate an adverse institutional environment by generating “stronger-together” benefits. Colocation can enable collective actions and create collective gains for MNEs in their interactions with the host government. We find that after a diplomatic dispute, Korean MNEs are more attracted to locations in China that already have a cluster of Korean firms, whether in the same/related industries or in unrelated industries; this is particularly the case for small MNEs and in locations with weak institutions."
44,4,April,2023,RESEARCH SUMMARY,A cognitive perspective on real options investment: CEO overconfidence,"Joon Mahn Lee, Jung Chul Park, Guoli Chen","While real options theory has been applied with the optimality assumption, actual real options investments are made by managers, who are subject to cognitive biases, especially under uncertainty. In this article, we focus on one important type of cognitive bias, overconfidence, to provide new insights on real options literature. We argue that overconfident CEOs will invest less in real options than non-overconfident CEOs. We also predict that the relationship between overconfident CEOs and firms' real options intensity will be strengthened when market uncertainty is higher. In a study of U.S. public firms, we find strong support across various tests that use multiple measures of overconfidence in CEOs and real options investments, and control for potential selection issues and other endogeneity concerns.","This article studies how a CEO's cognitive bias, overconfidence, may shape a firm's real option investments, which could result in a different level of strategic flexibility. We argue that overconfident CEOs have overly high expectations of their performance under uncertainty and/or underestimate the level of uncertainty in their strategic decision-making, which leads to lower investments in the firms' real options relative to non-overconfident CEOs. We study a sample of U.S. public firms and find strong evidence that an overconfident CEO is positively related to the real options investments at the firm level. We also find that this overconfidence effect becomes more pronounced in markets with greater uncertainty."
44,4,April,2023,RESEARCH SUMMARY,The “CEO in context” technique revisited: A replication and extension of Hambrick and Quigley (2014),"Tobias Keller, Martin Glaum, Andreas Bausch, Thorsten Bunz","Hambrick and Quigley's (2014) “CEO in context” (CiC) technique leads to a much larger CEO effect than traditional ANOVA or multilevel modeling. We replicate H&Q's study, apply their CiC technique to a much more comprehensive U.S. sample, and assess the sensitivity of the model findings to variations in method and data. We generally confirm H&Q's finding of a high CEO effect, but find a smaller industry effect and a larger firm effect in our much larger sample. Applying the CiC technique with adjusted R2s has only a moderate impact on year, industry, and firm effects, but markedly reduces the CEO effect. We also document that CiC model findings are sensitive to sample characteristics, namely firm size and CEO tenure.","Hambrick and Quigley (2014) introduced a new method to analyze the influence of CEOs on firm performance. The study's empirical analysis focused on large U.S. firms. We replicate the original study and extend it to a much larger, comprehensive sample of U.S. firms that is composed of 33,996 firm-year observations, compared to 4,866 firm-years in the original study. Controlling for the number of variables used in the estimations, the model attributes about a third of the total variance of firm performance (ROA) to the CEO. Further analyses show that the model findings differ for firms of different size and CEO tenure; the larger the firms and the longer the CEO tenures, the smaller tends to be the percentage of variance explained by the CEO."
44,4,April,2023,RESEARCH SUMMARY,Managing ecosystem emergence and evolution: Strategies for ecosystem architects,"Jarryd Daymond, Eric Knight, Maria Rumyantseva, Steven Maguire","While the notion of ecosystems has become prominent in scholarly and practitioner strategy literature in recent years, more can be done to bridge these two communities. In this introduction to the SMS Collection, we interrogate strategy scholarship from the perspective of “ecosystem architects,” who are private or public sector actors interested in nurturing and developing a given ecosystem as a whole. In doing so, we collate and discuss key articles published in the journals of the Strategic Management Society which, considered together, shed new light on processes of ecosystem emergence and evolution. We distill a range of insights for ecosystem architect practitioners and outline four strategies for them to create conditions appropriate to their ecosystem and its stage of development.","What insights does strategy research offer to practitioners interested in nurturing the creation and ongoing development of a range of different types of ecosystems? In this introduction to the SMS Collection, we distill relevant findings and outline four strategies for public and private ecosystem architects to create conditions appropriate to their ecosystem and its stage of development. Specifically, we outline approaches to create conditions for coalescence, coopetition, cooperation, and contained contestation within emerging and evolving ecosystems."
44,5,May,2023,RESEARCH SUMMARY,Issue Information,,,
44,5,May,2023,RESEARCH SUMMARY,Differentiation in microenterprises,Natalie A. Carlson,"Small unregistered firms contribute to a substantial proportion of global economic activity, particularly in developing regions. In explaining variation in productivity in these types of informal firms, research has focused primarily on the adoption of effective business practices and access to capital, with little focus on fundamental positioning. This article explores the nature of differentiation in microenterprises, introducing a text-based measure of differentiation using state-of-the-art sentence embeddings. Using a combined sample of nearly 10,000 microenterprises across eight developing countries, I examine whether (and which) microenterprises differentiate, whether differentiation is related to performance (and for whom), and whether any existing policy interventions affect differentiation.","Small unregistered firms contribute to a substantial proportion of global economic activity, particularly in developing regions. In studying how to improve the productivity of these types of tiny firms, researchers and policy makers have primarily focused on business practices and access to capital, rather than the fundamental market position of the product or service offered. This article explores the extent to which microenterprises differentiate themselves from peer businesses, introducing a measure of differentiation based on computational text analysis. Using a combined sample of nearly 10,000 microenterprises across eight developing countries, I examine whether (and which) microenterprises differentiate, whether differentiation is related to performance (and for whom), and whether any existing policy interventions affect differentiation."
44,5,May,2023,RESEARCH SUMMARY,Perceptions of political Self-Dealing? An empirical investigation of market returns surrounding the disclosure of politician stock purchases,"Mirzokhidjon Abdurakhmonov, Roary E. Snider, Jason W. Ridge, Dinesh Hasija","We investigate how congressional stock purchases may impact investor expectations of firm outcomes. Specifically, we argue that because there is information asymmetry regarding how public policy may impact a firm and investors perceive that members of the U.S. Congress possess insider governmental information and power over the regulatory landscape of a firm, a legislator's purchase of firm stock will generate abnormal returns. Furthermore, we argue that this response will be greater if the Congressperson has jurisdiction over the firm through committee assignments, and that the effect of jurisdiction will be strongest when the firm ties itself directly to the politician through political strategies (e.g., lobbying sponsored legislation, committee testimony, and political action committee contributions). We find support for many of our arguments in a broad sample of senator stock purchases between 2012 and 2020.",We examine stock purchases of the members of the U.S. Senate for years 2012–2020 and find that stock purchases by senate members generate abnormal returns. We also find that abnormal returns are higher if the senator has direct jurisdiction over the firm through committee assignments. We see an increase in abnormal returns if the firm is tied to the member of the U.S. Senate through lobbying-sponsored legislation and political action committee contributions. We also find that stocks both purchased and sold by senators experience negative abnormal returns over the 6–12 months following the transaction date. Our study provides insights into important public policy questions related to transparency and ethics in government and speaks to the question of investments by public servants.
